audio_file,text,duration
output\verses\genesis\genesis_12_verse_12.wav,"ni eeeba mli akɛ kɛ Ijiptbii lɛ na bo lɛ, amɛaakɛɛ akɛ, ‘Eŋa ni.’ Kɛkɛ lɛ amɛaagbe mi, shi bo lɛ amɛaahere oyiwala.",12.69
output\verses\genesis\genesis_12_verse_13.wav,"No hewɔ lɛ, kɛɛmɔ akɛ minyɛmi yoo ji bo, koni ahi ahã mi yɛ ohewɔ, ni miyi ana wala hu yɛ ohewɔ.”",9.99
output\verses\genesis\genesis_12_verse_14.wav,"Be ni Abram bashɛ Ijipt lɛ, Ijiptbii lɛ na yoo lɛ akɛ ehe yɛ fɛo naakpa.",7.1
output\verses\genesis\genesis_12_verse_15.wav,"Farao lumɛi lɛ hu na lɛ, ni amɛyajie eyi amɛhã Farao, ni abaŋɔ yoo lɛ kɛtee Farao we lɛ.",9.16
output\verses\genesis\genesis_12_verse_16.wav,"Sarai hewɔ lɛ Farao hiɛ Abram jogbaŋŋ. Ni no hewɔ lɛ, Abram na toi kɛ tsinai kɛ tejihii kɛ webii kɛ weyei kɛ tejiyei kɛ yoomai.",13.67
output\verses\genesis\genesis_12_verse_17.wav,"Shi Abram ŋa Sarai hewɔ lɛ, Yehowa hã Farao kɛ ewe lɛ na amanehulu ni naa wa.",7.77
output\verses\genesis\genesis_12_verse_18.wav,"No hewɔ lɛ, Farao tsɛ Abram ni ebi lɛ akɛ, “Mɛni ofee mi nɛɛ? Mɛɛba okɛɛɛ mi akɛ yoo lɛ oŋa ni lɛ?",10.35
output\verses\genesis\genesis_12_verse_19.wav,"Mɛɛba okɛɛ akɛ onyɛmi yoo ji lɛ, ni ohã miŋɔ lɛ mifee miŋa lɛ? Agbɛnɛ naa oŋa, ŋɔɔ lɛ ni oya!”",9.59
output\verses\genesis\genesis_12_verse_20.wav,Kɛkɛ ni Farao famɔ hii komɛi eto ehe akɛ amɛyajie lɛ kɛ eŋa kɛ nɔ fɛɛ nɔ ni eyɔɔ lɛ gbɛ.,9.59
output\verses\genesis\genesis_13_verse_1.wav,"Abram kɛ eŋa kɛ nɔ fɛɛ nɔ ni eyɔɔ lɛ je Ijipt, ni Lot fata ehe; amɛtee wuoyigbɛ.",7.97
output\verses\genesis\genesis_13_verse_2.wav,No mli lɛ Abram ena nii babaoo: shĩaŋ kooloi kɛ jwiɛtɛi kɛ shika tsuru.,8.23
output\verses\genesis\genesis_13_verse_3.wav,"Etsa egbɛfãa lɛ nɔ fiofio kɛjɛ wuoyigbɛ aahu kɛtee Betel. Eyashɛ he ko yɛ Betel kɛ Ai teŋ, he ni eshi ebuu lɛ yɛ ni ema afɔleshãa latɛ yɛ tsutsu ko lɛ.",14.82
output\verses\genesis\genesis_13_verse_4.wav,Biɛ Abram ja Yehowa yɛ.,2.65
output\verses\genesis\genesis_13_verse_5.wav,"Lot ni kɛ Abram nyiɛ lɛ hu yɛ toi kɛ tsinai kɛ bui,",4.41
output\verses\genesis\genesis_13_verse_6.wav,"ni no hewɔ lɛ, shikpɔŋ lɛ faaa hãaa amɛ bɔ ni amɛyi enyɔ lɛ fɛɛ amɛaahi he kome, ejaakɛ amɛnibii fa.",10.23
output\verses\genesis\genesis_13_verse_7.wav,Kɛkɛ ni bei ba Abram koolookwɛlɔi lɛ kɛ Lot koolookwɛlɔi lɛ ateŋ. Nɛkɛ be nɛɛ mli lɛ Kanaanbii lɛ kɛ Perizbii lɛ yɛ shikpɔŋ lɛ nɔ.,12.76
output\verses\genesis\genesis_13_verse_8.wav,"Kɛkɛ ni Abram kɛɛ Lot akɛ, “Kaahã bei miiba mi kɛ bo teŋ kɛ mikoolookwɛlɔi lɛ kɛ okoolookwɛlɔi lɛ ateŋ, ejaakɛ nyɛmimɛi ji wɔ.",13.68
output\verses\genesis\genesis_13_verse_9.wav,"Shikpɔŋ muu lɛ fɛɛ kã ohiɛ nɛɛ. Tse ohe yɛ mihe. Kɛji okɔ abɛkugbɛ lɛ, no lɛ makɔ ninejurɔgbɛ; ni kɛji okɔ ninejurɔgbɛ lɛ, no lɛ makɔ abɛkugbɛ.”",14.14
output\verses\genesis\genesis_13_verse_10.wav,"Kɛkɛ ni Lot wo ehiɛ nɔ ni ekwɛ shikpɔŋ lɛ kɛkpe, ni ena akɛ Yordan jɔɔ lɛ fɛɛ yɛ frɔ̃frɔ̃ aahu kɛtee Zoar tɔ̃ɔ. Etamɔ Yehowa trom lɛ aloo Ijipt shikpɔŋ lɛ. Nɛkɛ be mli lɛ, Yehowa kpãtãko Sodom kɛ Gomora hiɛ.",20.26
output\verses\genesis\genesis_13_verse_11.wav,"Kɛkɛ ni Lot kɔ Yordan jɔɔ lɛ fɛɛ, ni efã kɛtee bokãgbɛ. Bɔ ni fee ni amɛyi enyɔ lɛ amɛgbala mli nɛ.",9.34
output\verses\genesis\genesis_13_verse_12.wav,"Abram hi Kanaan shikpɔŋ lɛ nɔ, ni Lot hi maji ni yɔɔ Yordan jɔɔ lɛ mli lɛ amli. Lot shi ebuu lɛ shii abɔ kɛyashi be ni eyashɛ Sodom.",13.44
output\verses\genesis\genesis_13_verse_13.wav,"Shi Sodombii lɛ yiwalɔi ji amɛ, ni amɛfeɔ esha amɛshiɔ Yehowa.",6.71
output\verses\genesis\genesis_13_verse_14.wav,"Be ni Lot kɛ Abram egbala mli sɛɛ lɛ, Yehowa kɛɛ Abram akɛ, “Wo ohiɛ nɔ, ni ojɛ he ni oyɔɔ lɛ okwɛ kooyigbɛ kɛ wuoyigbɛ kɛ bokãgbɛ kɛ anaigbɛ shikpɔŋ ni onaa nɛɛ,",16.69
output\verses\genesis\genesis_13_verse_15.wav,bo kɛ oshwiei mikɛbaahã kɛaatee naanɔ.,4.11
output\verses\genesis\genesis_13_verse_16.wav,"Mahã oshwiei afa tamɔ shikpɔŋ mlu, ni kɛji mɔ ko aaanyɛ shikpɔŋ mlu akane lɛ, belɛ aaanyɛ oshwiei lɛ hu akane.",10.33
output\verses\genesis\genesis_13_verse_17.wav,"Tee shi, nyiɛmɔ shikpɔŋ lɛ nɔ kɛtsɔ̃ ekɛlɛ kɛ elɛɛmɔ nɔ, shi bo mikɛbaahã”.",7.03
output\verses\genesis\genesis_13_verse_18.wav,"Kɛkɛ ni Abram fã ebuu lɛ, ni eba ebahi Mamre tsei krɔŋkrɔŋi lɛ ni yɔɔ Hebron lɛ amasɛi, ni ema afɔleshãa latɛ yɛ jɛi ehã Yehowa.",14.56
output\verses\genesis\genesis_14_verse_1.wav,"Maŋtsɛmɛi ejwɛ, Babilon maŋtsɛ Amrafel kɛ Elasar maŋtsɛ Ariok kɛ Elam maŋtsɛ Kedorlaomer kɛ Goiim maŋtsɛ Tidal abei amli lɛ,",12.96
output\verses\genesis\genesis_14_verse_2.wav,maŋtsɛmɛi nɛɛ fã ta amɛshi Sodom maŋtsɛ Bera kɛ Gomora maŋtsɛ Birsha kɛ Adma maŋtsɛ Shinab kɛ Zeboim maŋtsɛ Shemeber kɛ Bela ni ji Zoar maŋtsɛ lɛ.,14.38
output\verses\genesis\genesis_14_verse_3.wav,Maŋtsɛmɛi nɛɛ fɛɛ fee ta kome yɛ Sidim jɔɔ lɛ ni etsɔ̃ Ŋoo Ŋshɔ agbɛnɛ lɛ mli.,7.32
output\verses\genesis\genesis_14_verse_4.wav,"Maŋtsɛmɛi nɛɛ sɔmɔ Kedorlaomer afii nyɔŋma kɛ enyɔ, shi afi ni ji nyɔŋma kɛ etɛ̃ lɛ nɔ lɛ, amɛtse atua.",8.94
output\verses\genesis\genesis_14_verse_5.wav,"Afi ni ji nyɔŋma kɛ ejwɛ lɛ nɔ lɛ, Kedorlaomer kɛ maŋtsɛmɛi ni fata ehe lɛ ba ni amɛbaye Refabii anɔ kunim yɛ Ashterot-Karnaim. Amɛye Zuzbii anɔ yɛ Ham, ni amɛye Embii anɔ yɛ Kiriataim ŋa lɛ nɔ.",18.71
output\verses\genesis\genesis_14_verse_6.wav,"Amɛye Horbii hu anɔ yɛ amɛgɔŋ Edom lɛ nɔ, ni amɛnyiɛ amɛsɛɛ kɛyashi El-Paran ni kã shiaŋa kplanaa lɛ naa lɛ.",10.63
output\verses\genesis\genesis_14_verse_7.wav,"Amɛku amɛsɛɛ ni amɛba En-mishpat, (no ji Kadesh) ni amɛye Amalekbii ashikpɔŋ lɛ fɛɛ nɔ, kɛ Amorbii ni yɔɔ Hazazon-Tamar lɛ hu anɔ.",12.78
output\verses\genesis\genesis_14_verse_8.wav,"Kɛkɛ ni Sodom maŋtsɛ kɛ Gomora maŋtsɛ kɛ Adma maŋtsɛ kɛ Ziboim maŋtsɛ kɛ Bela, ni atsɛɔ lɛ Zoar hu lɛ maŋtsɛ lɛ fã, ni amɛbagba ta yɛ Sidim jɔɔ lɛ mli,",13.82
output\verses\genesis\genesis_14_verse_9.wav,ni amɛkɛ Elam maŋtsɛ Kedorlaomer kɛ Goiim maŋtsɛ Tidal kɛ Babilon maŋtsɛ Amrafel kɛ Elasar maŋtsɛ Ariok bawu; maŋtsɛmɛi ejwɛ kɛ maŋtsɛmɛi enumɔ wu.,14.37
output\verses\genesis\genesis_14_verse_10.wav,"Shi Sidim jɔɔ lɛ mli lɛ, amãtɛ bui sɔŋŋ yɔɔ jɛi. Awo Sodom kɛ Gomora maŋtsɛmɛi lɛ afoi, ni amɛnyɔnyɔi bui lɛ amli, shi maŋtsɛmɛi ni eshwɛ lɛ jo foi kɛtee gɔŋ lɛ nɔ.",15.31
output\verses\genesis\genesis_14_verse_11.wav,"No hewɔ lɛ, maŋtsɛmɛi ejwɛ lɛ ŋɔ Sodom kɛ Gomora nii fɛɛ kɛ niyenii fɛɛ, ni amɛyiŋ amɛtee.",9.06
output\verses\genesis\genesis_14_verse_12.wav,Amɛŋɔ Abram nyɛmibi Lot ni yɔɔ Sodom lɛ hu kɛ enibii kɛtee.,5.79
output\verses\genesis\genesis_14_verse_13.wav,"Shi nuu ko ni jo foi kɛjɛ ta lɛ mli lɛ ba ni ebagba Abram, Hebrinyo lɛ ni ehe shi yɛ he ni Mamre, Amornyo lɛ, wɔŋ koo lɛ yɔɔ lɛ. Shi Eshkol kɛ Aner nyɛmi ji Mamre; ni amɛkɛ Abram ekpãŋ.",16.9
output\verses\genesis\genesis_14_verse_14.wav,"Be ni Abram nu akɛ aŋɔ enyɛmibi lɛ nom lɛ, ekɛ etsuji ohai etɛ̃ kɛ nyɔŋma kɛ kpaanyɔ ni le ta he nii, ni afɔ amɛ yɛ ewe lɛ, fã ta, ni etiu maŋtsɛmɛi lɛ kɛtee Dan.",14.99
output\verses\genesis\genesis_14_verse_15.wav,"Ekɛ etsuji lɛ gba ta wo amɛhe nyɔɔŋ, ni enine tsɔ̃ amɛnɔ, ni etiu amɛ kɛtee Hoba ni yɔɔ Damasko kooyigbɛ lɛ.",10.69
output\verses\genesis\genesis_14_verse_16.wav,"Eŋɔ nibii lɛ fɛɛ kɛ enyɛmibi Lot lɛ hu kɛ enibii lɛ, kɛ yei lɛ hu kɛ maŋbii lɛ kɛku sɛɛ kɛba.",8.81
output\verses\genesis\genesis_14_verse_17.wav,"Be ni Abram eye Kedorlaomer kɛ maŋtsɛmɛi ni fata ehe lɛ anɔ kunim ni eku esɛɛ eba lɛ, Sodom maŋtsɛ lɛ tee eyakpee lɛ yɛ Shaveh Jɔɔ ni atsɛɔ jɛi Maŋtsɛ Jɔɔ lɛ mli.",14.86
output\verses\genesis\genesis_14_verse_18.wav,Ni Salem maŋtsɛ Melkizedek kɛ aboloo kɛ wain ba. Ŋwɛi Flooflo Nyɔŋmɔ lɛ osɔfo ji lɛ.,8.31
output\verses\genesis\genesis_14_verse_19.wav,"Ejɔɔ Abram ni ekɛɛ, “Ŋwɛi Flooflo Nyɔŋmɔ, ŋwɛi kɛ shikpɔŋ bɔlɔ lɛ ajɔɔ Abram;",7.77
output\verses\genesis\genesis_14_verse_20.wav,ni ajie Ŋwɛi Flooflo Nyɔŋmɔ lɛ ni hã oye ohenyɛlɔi lɛ anɔ kunim lɛ yi.” Ni Abram hã Melkizedek nii lɛ fɛɛ mlijai nyɔŋma mli ekome.,12.26
output\verses\genesis\genesis_14_verse_21.wav,"Kɛkɛ lɛ Sodom maŋtsɛ lɛ kɛɛ Abram akɛ, “Ŋɔɔ migbɔmɛi lɛ ohã mi, shi haa nibii lɛ ŋɔɔ ohã ohe.”",9.26
output\verses\genesis\genesis_14_verse_22.wav,"Shi Abram kɛɛ Sodom maŋtsɛ lɛ akɛ, “Mina Ŋwɛi Flooflo Nyɔŋmɔ ni ji ŋwɛi kɛ shikpɔŋ bɔlɔ lɛ",8.18
output\verses\genesis\genesis_14_verse_23.wav,"akɛ kɛjɛ kpãa nɔ aahu kɛyashi tokota naa kpãa nɔ, nɔ fɛɛ nɔ ni ji onɔ lɛ, kɛji mikɔ eko fii! Koni okakɛɛ akɛ, ‘Mi, mifee Abram niiatsɛ.’",13.59
output\verses\genesis\genesis_14_verse_24.wav,"Miŋɔɔɔ nɔ ko nɔ ko akɛ ja nɔ ni oblahii lɛ eye kɛkɛ, kɛ hii ni kɛ mi tee lɛ, Aner kɛ Eshkol kɛ Mamre; amɛ lɛ hã ni amɛŋɔ amɛgbɛfaŋnɔ lɛ.”",14.73
output\verses\genesis\genesis_15_verse_1.wav,"Enɛ sɛɛ lɛ Yehowa kɛ Abram wie yɛ ninaa mli akɛ, “Kaashe gbeyei, Abram, mabu ohe, ni mabaa oyi.”",10.0
output\verses\genesis\genesis_15_verse_2.wav,"Shi Abram kɛɛ, “Nuŋtsɔ Nyɔŋmɔ, mɛni obaahã mi, mi ni minyiɛ ni mibɛ bi ni mɔ ni baaye migboshinii lɛ ji Eliezer, Damaskonyo nɛɛ?”",12.56
output\verses\genesis\genesis_15_verse_3.wav,"Abram tee nɔ ekɛɛ, “Naa, mi lɛ, ohãko mi shwie ko, ni nyɔŋ ni afɔ lɛ yɛ miwe lɛ baaye minii.”",9.13
output\verses\genesis\genesis_15_verse_4.wav,"Kɛkɛ ni Yehowa kɛɛ Abram akɛ, “Mɔ nɛ yeŋ onii; shi moŋ bi ni aaajɛ bo diɛŋtsɛ omusuŋ lɛ, lɛ ebaaye onii.”",10.61
output\verses\genesis\genesis_15_verse_5.wav,"Nyɔŋmɔ kɛ Abram je kpo ni ekɛɛ lɛ akɛ, “Kwɛmɔ ŋwɛi koo, ni okane ŋulamii lɛ akɛ ooonyɛ amɛ okane lo.” Ekɛɛ Abram akɛ, “Bɔ ni oshwiei aaatamɔ nɛ.”",13.48
output\verses\genesis\genesis_15_verse_6.wav,"Abram kɛ ehiɛ fɔ̃ Yehowa nɔ, ni no hewɔ lɛ, Yehowa na ehe tsuijurɔ.",6.5
output\verses\genesis\genesis_15_verse_7.wav,"Kɛkɛ ni Nyɔŋmɔ kɛɛ Abram akɛ, “Mi ji Yehowa mɔ ni jie bo kɛjɛ Ur yɛ Babilonbii ashikpɔŋ lɛ nɔ koni maŋɔ nɛkɛ shikpɔŋ nɛɛ mahã bo akɛ onɔ lɛ.”",12.34
output\verses\genesis\genesis_15_verse_8.wav,"Shi Abram bi akɛ, “Ao Nuŋtsɔ Nyɔŋmɔ, mɛni mikɛaale akɛ eeetsɔ̃ minɔ?”",7.34
output\verses\genesis\genesis_15_verse_9.wav,"Nyɔŋmɔ kɛɛ lɛ akɛ, “Kɛ tsinayoo ni eye afii etɛ̃ kɛ too abotiayoo ni eye afii etɛ̃ kɛ ojwɛni ni eye afii etɛ̃ kɛ kosɛɛ okpo kɛ shĩa okpo aba.”",14.87
output\verses\genesis\genesis_15_verse_10.wav,"Abram kɛ enɛɛmɛi fɛɛ ba. Abram folɔ amɛmli enyɔɔnyɔɔnyɔ, ni eto fãfãi lɛ eshwie biɛ kɛ biɛ, eko yɛ eko ŋlɛnɔ; shi loofɔji lɛ efolɔɔɔ amɛmli.",14.7
output\verses\genesis\genesis_15_verse_11.wav,"Kɛkɛ ni loofɔji ni yeɔ loo kpeleke shi basɔmɔ kooloi agbohii lɛ anɔ, shi Abram shwie amɛ.",8.79
output\verses\genesis\genesis_15_verse_12.wav,"Be ni hulu yaa eyanyɔ shi lɛ, wɔ ni tsii nyɔ Abram nɔ, ni duŋ kpii kɛ gbeyei ni naa wa mɔ lɛ.",8.32
output\verses\genesis\genesis_15_verse_13.wav,"Kɛkɛ ni Yehowa kɛɛ Abram akɛ, “Na ole akɛ oshwiei aaatsɔ̃mɔ gbɔi yɛ shikpɔŋ ni jeee amɛnɔ nɔ ni amɛaasɔ̃mɔ shikpɔŋ lɛ nɔ bii lɛ ni gbɔmɛi nɛɛ aaawa oshwiei lɛ ayi afii ohai ejwɛ.",16.79
output\verses\genesis\genesis_15_verse_14.wav,"Shi nakai jeŋmaŋ lɛ hu ni amɛaasɔ̃mɔ lɛ, magbala amɛtoi, ni no sɛɛ lɛ, oshwiei lɛ aaashi jɛi kɛ nii babaoo.",11.04
output\verses\genesis\genesis_15_verse_15.wav,Bo lɛ oooyanina otsɛmɛi lɛ yɛ hejɔlɛ mli; ni aaafu bo be mli ni ogbɔ gbɔlɛ kpakpa.,7.33
output\verses\genesis\genesis_15_verse_16.wav,Shi yinɔ ni ji ejwɛ sɛɛ lɛ oshwiei lɛ aaaku amɛsɛɛ kɛaaba biɛ ekoŋŋ; ejaakɛ eshai ni Amorbii feɔ lɛ shɛko he ni kɛ eshɛ ni abaagbala amɛtoi.”,13.2
output\verses\genesis\genesis_15_verse_17.wav,"Ni be ni hulu enyɔ shi ni hiɛ ebu lɛ, naa, kukwɛi kɛ emli la ni miifã lasu kɛ kɔti ni miitso gboŋaa batsɔ̃ loi fãfãafãi lɛ ateŋ kɛho.",12.76
output\verses\genesis\genesis_15_verse_18.wav,"Ni nakai gbi lɛ, Nyɔŋmɔ kɛ Abram kpãŋ ni ekɛɛ, “Oshwiei lɛ mikɛ nɛkɛ shikpɔŋ nɛɛ baahã, kɛjɛ Ijipt faa lɛ naa kɛyashi faa kpeteŋkple ni ji Eufrate Faa lɛ naa.",15.3
output\verses\genesis\genesis_15_verse_19.wav,Kenbii kɛ Kenizbii kɛ Kadmonbii,4.48
output\verses\genesis\genesis_15_verse_20.wav,kɛ Hitbii kɛ Perizbii kɛ Refabii 21kɛ Amorbii kɛ Kanaanbii kɛ Girgashbii kɛ Yebusbii ashikpɔŋ lɛ.”,4.64
output\verses\genesis\genesis_16_verse_1.wav,"Agbɛnɛ Sarai, Abram ŋa lɛ fɔɔɔ; shi eyɛ weyoo Ijiptyoo ko ni egbɛi ji Hagar.",8.94
output\verses\genesis\genesis_16_verse_2.wav,"Ni Sarai kɛɛ Abram akɛ, “Naa, Yehowa etsi mifɔmɔ naa. Okɛ minyɔŋyoo lɛ ayawɔ; eko lɛ mana bii kɛaatsɔ̃ enɔ.” Ni Abram bo Sarai toi.",14.62
output\verses\genesis\genesis_16_verse_3.wav,"No hewɔ lɛ, Sarai ŋɔ Ijiptyoo Hagar, eweyoo lɛ, ehã ewu Abram gbãlã, be ni Abram eye afii nyɔŋma yɛ Kanaan shikpɔŋ lɛ nɔ lɛ.",12.66
output\verses\genesis\genesis_16_verse_4.wav,"Abram kɛ Hagar na musu; shi be ni Hagar na akɛ ehiɛ musu lɛ, ewula lɛ heguɔ gbo yɛ ehiɛ.",8.21
output\verses\genesis\genesis_16_verse_5.wav,"Kɛkɛ ni Sarai kɛɛ Abram akɛ, “Sane ni eŋɔɔɔ ni akɛyeɔ mi nɛɛ, sɔ̃ lɛ atere bo! Mikɛ miweyoo lɛ hã bo; shi kɛjɛ be ni ena akɛ ena musu lɛ, mihiɛ eshwiei shi yɛ ehiɛ. Nyɔŋmɔ aaakojo mi kɛ bo teŋ sane nɛɛ.”",19.29
output\verses\genesis\genesis_16_verse_6.wav,"Shi Abram kɛɛ Sarai akɛ, “Naa, oweyoo lɛ yɛ odɛ̃ŋ; feemɔ lɛ bɔ ni osumɔɔ.” No hewɔ lɛ, Sarai nyɛ Hagar hiɛ, ni Hagar jo foi kɛje eŋɔɔ.",15.02
output\verses\genesis\genesis_16_verse_7.wav,"Yehowa bɔfo lɛ na Hagar yɛ nubu ko he yɛ ŋa lɛ nɔ, yɛ Shur gbɛ lɛ nɔ nubu lɛ he.",7.39
output\verses\genesis\genesis_16_verse_8.wav,"Bɔfo lɛ bi lɛ akɛ, “Hagar! Sarai weyoo, nɛgbɛ ojɛ? Ni nɛgbɛ hu oyaa?” Hagar to he ekɛɛ, “Miijo foi kɛjɛ miwula Sarai ŋɔɔ.”",13.03
output\verses\genesis\genesis_16_verse_9.wav,"Yehowa bɔfo lɛ kɛɛ lɛ akɛ, “Kuu osɛɛ kɛya owula lɛ ŋɔɔ, ni oba ohe shi ohã lɛ.”",8.26
output\verses\genesis\genesis_16_verse_10.wav,"Asaŋ Yehowa bɔfo lɛ kɛɛ Hagar akɛ, “Fa mahã oshwiei afa babaoo bɔ ni anyɛŋ amɛ akane.”",10.33
output\verses\genesis\genesis_16_verse_11.wav,"Yehowa bɔfo lɛ tee nɔ ekɛɛ Hagar akɛ, “Naa, ohiɛ musu ni obaafɔ binuu ni gbɛi ni ooowo lɛ ji Ishmael, ejaakɛ Nyɔŋmɔ ena bɔ ni onaa nɔ ni oyoyro lɛ,",15.72
output\verses\genesis\genesis_16_verse_12.wav,"shi gbekɛ lɛ aaafee enii tamɔ ŋaŋ teji, ekɛ mɔ fɛɛ mɔ aaana, ni mɔ fɛɛ mɔ hu kɛ lɛ aaana, ni ekɛ ewekumɛi efeŋ nɔ ko.”",11.85
output\verses\genesis\genesis_16_verse_13.wav,"Hagar bi ehe akɛ, “Ani mina Nyɔŋmɔ lɛɛlɛŋ ni fɛɛ sɛɛ lɛ mihiɛ kã lolo nɛɛ?” No hewɔ lɛ, etsɛ Yehowa mɔ ni kɛ lɛ wie lɛ akɛ, “Nyɔŋmɔ ni naa mi.”",13.47
output\verses\genesis\genesis_16_verse_14.wav,"Enɛ hewɔ lɛ, atsɛ nɛkɛ bu nɛɛ akɛ, “Beer-lahai-roi”, eshishi ji, “Mɔ ni hiɛ kã ni enaa mi” lɛ nubu. Nubu nɛɛ yɛ Kadesh kɛ Bered teŋ.",13.39
output\verses\genesis\genesis_16_verse_15.wav,"Ni Hagar kɛ Abram fɔ binuu, ni Abram wo ebi ni Hagar fɔ lɛ gbɛi akɛ Ishmael.",7.25
output\verses\genesis\genesis_16_verse_16.wav,Abram eye afii nyɔŋmai kpaanyɔ kɛ ekpaa be ni Hagar kɛ lɛ fɔ Ishmael lɛ.,7.85
output\verses\genesis\genesis_17_verse_1.wav,"Be ni Abram eye afii nyɔŋmai nɛɛhu kɛ nɛɛhu lɛ, Yehowa jie ehe kpo etsɔ̃ɔ lɛ, ni ekɛɛ lɛ akɛ, “Mi ji Nyɔŋmɔ Ofe lɛ, ba ojeŋ yɛ mihiɛ koni shwamɔ ko akahi ohe.",15.06
output\verses\genesis\genesis_17_verse_2.wav,"Mikɛ mikpãŋmɔ lɛ baaŋmɛ mi kɛ bo teŋ, ni mahã oshwiei afa babaoo diɛŋtsɛ.”",6.69
output\verses\genesis\genesis_17_verse_3.wav,"Kɛkɛ ni Abram ŋɔ ehiɛ ebu shi, ni Nyɔŋmɔ kɛɛ lɛ akɛ,",4.99
output\verses\genesis\genesis_17_verse_4.wav,"“Mi kɛ bo miikpãŋ kpãŋmɔ nɛɛ, ni oootsɔ̃ maji pii atsɛ.",5.62
output\verses\genesis\genesis_17_verse_5.wav,"Atsɛŋ bo Abram dɔŋŋ, shi moŋ aaatsɛ bo Abraham, ejaakɛ mahã ofee maji pii atsɛ.",9.11
output\verses\genesis\genesis_17_verse_6.wav,"Mahã owo shwiei babaoo diɛŋtsɛ, ni mahã majimaji ajɛ omli ni maŋtsɛmɛi aaajɛ omli.",9.09
output\verses\genesis\genesis_17_verse_7.wav,"“Mahã mikpãŋmɔ ni kã mi kɛ bo teŋ lɛ ama shi shiŋŋ, ni eeetsɔ̃ naanɔ kpãŋmɔ ehã oshwiei ni aaaba yɛ osɛɛ lɛ yɛ amɛyinɔi fɛɛ mli; matsɔ̃ Nyɔŋmɔ mahã bo kɛ oshwiei ni aaaba yɛ osɛɛ lɛ.",16.59
output\verses\genesis\genesis_17_verse_8.wav,"Mikɛ shikpɔŋ ni obato gbɔ yɛ nɔ nɛɛ baahã bo kɛ oshwiei ni aaaba yɛ osɛɛ lɛ. Kanaan shikpɔŋ muu lɛ fɛɛ aaatsɔ̃ oshwiei anɔ kɛya naanɔ, ni matsɔ̃ amɛNyɔŋmɔ.”",14.0
output\verses\genesis\genesis_17_verse_9.wav,"Asaŋ Nyɔŋmɔ kɛɛ Abraham akɛ, “Yɛ nyɛgbɛfaŋ lɛ, bo kɛ oshwiei ni aaaba yɛ osɛɛ lɛ, nyɛyea mikpãŋmɔ lɛ nɔ yɛ amɛyinɔi lɛ fɛɛ mli. \",12.75
output\verses\genesis\genesis_17_verse_10.wav,Bɔ ni nyɛbaato mikpãŋmɔ lɛ ni yɔɔ mi kɛ bo kɛ oshwiei ni aaabaye osɛɛ lɛ teŋ nɛ: nuu fɛɛ nuu ni yɔɔ nyɛteŋ lɛ afo lɛ ketia.,11.4
output\verses\genesis\genesis_17_verse_11.wav,"Afolɔ nyɛ ketia, ni no atsɔ̃ kpãŋmɔ ni yɔɔ mi kɛ nyɛ teŋ lɛ he okadi.",5.84
output\verses\genesis\genesis_17_verse_12.wav,"Binuu fɛɛ binuu ni eyɔɔ nyɛteŋ ni eye gbii kpaanyɔ lɛ, afo lɛ ketia; binuu fɛɛ binuu yɛ nyɛyinɔi fɛɛ mli, mɔ ni afɔ lɛ yɛ owe lɛ jio, akɛ oshika he lɛ yɛ gbɔ ni jɛɛɛ oshwiei lɛ ateŋ jio, afo lɛ ketia.",19.13
output\verses\genesis\genesis_17_verse_13.wav,Fo afo mɔ ni afɔ lɛ yɛ owe lɛ mli kɛ mɔ ni okɛ oshika he lɛ fɛɛ ketia koni mikpãŋmɔ lɛ ahi nyɛheloo mli akɛ naanɔ kpãŋmɔ.,11.79
output\verses\genesis\genesis_17_verse_14.wav,Nuu foolɔ ko ni afoko lɛ ketia lɛ akabu lɛ ashi mimɛi lɛ anɔ; eku mikpãŋmɔ lɛ mli.”,8.3
output\verses\genesis\genesis_17_verse_15.wav,"Asaŋ Nyɔŋmɔ kɛɛ Abraham akɛ, “Oŋa Sarai lɛ, kaatsɛ egbɛi akɛ Sarai dɔŋŋ, shi abaatsɛ lɛ Sara.",10.21
output\verses\genesis\genesis_17_verse_16.wav,"Majɔɔ lɛ ni asaŋ mahã okɛ lɛ afɔ binuu. Majɔɔ lɛ, ni eeetsɔ̃ maji anyɛ, ni maji anɔ maŋtsɛmɛi aaajɛ emli.”",10.98
output\verses\genesis\genesis_17_verse_17.wav,"Kɛkɛ ni Abraham kɛ ehiɛ bu shi ni eŋmɔ, ni ekɛɛ ehe akɛ, “Ani nuu ni eye afii oha lɛ aaanyɛ ekɛ yoo afɔ bi lo? Sara ni eye afii nyɔŋmai nɛɛhu lɛ aaanyɛ afɔ bi lo?”",15.57
output\verses\genesis\genesis_17_verse_18.wav,"Abraham kɛɛ Nyɔŋmɔ akɛ, “Ao, mina ni kulɛ Ishmael yi na wala yɛ ohiɛ.”",7.22
output\verses\genesis\genesis_17_verse_19.wav,"Nyɔŋmɔ kɛɛ akɛ, “Okɛ oŋa Sara lɛ baafɔ binuu, ni obaawo lɛ gbɛi akɛ Isak. Mahã mi kɛ lɛ kpãŋmɔ lɛ ama shi ni etsɔ̃ naanɔ kpãŋmɔ ehã eshwiei ni aaaba yɛ esɛɛ lɛ.",15.51
output\verses\genesis\genesis_17_verse_20.wav,"Yɛ Ishmael hu gbɛfaŋ lɛ, mibo bo toi. Naa, majɔɔ lɛ; mahã eshwere ni ewo shwiei babaoo diɛŋtsɛ. Eeefɔ lumɛi nyɔŋma kɛ enyɔ, ni mahã efee maŋ kpeteŋkple.",14.75
output\verses\genesis\genesis_17_verse_21.wav,"Shi mikpãŋmɔ lɛ, Isak mɔ ni Sara kɛ bo aaafɔ biɛ afi naakplɔ lɛ, lɛ mikɛaakpãŋ.”",7.76
output\verses\genesis\genesis_17_verse_22.wav,"Be ni Nyɔŋmɔ kɛ Abraham ewie egbe naa lɛ, Nyɔŋmɔ shi Abraham ni etee ŋwɛi.",6.48
output\verses\genesis\genesis_17_verse_23.wav,"Kɛkɛ ni Abraham ŋɔ ebi Ishmael kɛ hii fɛɛ ni afɔ yɛ ewe lɛ kɛ hii fɛɛ ni ekɛ eshika he, nuu fɛɛ nuu ni yɔɔ eshĩa mli bii lɛ ateŋ lɛ, ni efolɔ amɛ fɛɛ ketia yɛ nakai gbi lɛ nɔ nɔŋŋ, tamɔ bɔ ni Nyɔŋmɔ kɛ lɛ wie lɛ.",19.99
output\verses\genesis\genesis_17_verse_24.wav,"Abraham eye afii nyɔŋmai nɛɛhu kɛ nɛɛhu be ni afo lɛ ketia lɛ,",5.9
output\verses\genesis\genesis_17_verse_25.wav,ni ebi Ishmael eye afii nyɔŋma kɛ etɛ̃ be ni afo lɛ ketia lɛ.,5.71
output\verses\genesis\genesis_17_verse_26.wav,"Nakai gbi lɛ nɔ nɔŋŋ afo Abraham kɛ ebi Ishmael fɛɛ ketia. 27Abraham we lɛ bii fɛɛ, mɛi ni afɔ yɛ shĩa kɛ mɛi ni akɛ shika he yɛ gbɔi adɛŋ fɛɛ, afolɔ amɛ ketia afata ehe.",5.24
output\verses\genesis\genesis_18_verse_1.wav,"Yehowa jie ehe kpo etsɔ̃ɔ Abraham yɛ Mamre tsei lɛ ahe, be ni eta shi yɛ buu lɛ shinaa lɛ naa shwane ketekete lɛ.",10.38
output\verses\genesis\genesis_18_verse_2.wav,"Abraham yaawo ehiɛ nɔ ni ekwɛ lɛ, naa hii etɛ̃ damɔ emasɛi. Be ni ena amɛ lɛ, esha foi kɛjɛ buu lɛ shinaa lɛ shi kɛtee koni eyakpee amɛ. Ekoto amɛ",14.78
output\verses\genesis\genesis_18_verse_3.wav,"ni ekɛɛ akɛ, “MiNuŋtsɔ, kɛji ona mihe tsuijurɔ lɛ, miikpa bo fai, kaaho otsulɔ he ooya.",9.9
output\verses\genesis\genesis_18_verse_4.wav,"Hã ni ayɛ nu fioo kɛba ni nyɛkɛfɔ nyɛnaji ahe, ni nyɛjɔɔ nyɛhe yɛ tso lɛ shishi",6.37
output\verses\genesis\genesis_18_verse_5.wav,"koni mayakɔ aboloo atrɔma kome kɛba ni nyɛkɛwo nyɛdaaŋ. No sɛɛ koni nyɛfoŋ kɛya, akɛni nyɛbatsɔ̃ otsulɔ ŋɔɔ nɛɛ.” Amɛkɛɛ lɛ akɛ, “Feemɔ bɔ ni okɛɛ lɛ.”",14.33
output\verses\genesis\genesis_18_verse_6.wav,"Kɛkɛ ni Abraham yiŋ kɛtee Sara ŋɔɔ oya mli yɛ buu lɛ mli, ni ekɛɛ, “Feemɔ mramra, tii mã kiloi etɛ̃ koni okpɔtɔ ni okɛshã aboloo.”",13.02
output\verses\genesis\genesis_18_verse_7.wav,"Kɛkɛ ni Abraham sha foi kɛtee tsinai lɛ ateŋ ni eyamɔ tsinabi ni esako ni hi, ni ekɛhã etsulɔ ko, ni tsulɔ lɛ ye ehe oyai ni ekɛfee niyenii.",13.03
output\verses\genesis\genesis_18_verse_8.wav,"Kɛkɛ ni Abraham wo butru kɛ fufɔ kɛ tsinabi loo ni akɛfee niyenii lɛ ni ekɛbamamɔ gbɔi lɛ ahiɛ, ni edamɔ amɛhiɛ esɔ̃mɔ amɛ yɛ tso lɛ shishi ni amɛye nii lɛ.",14.91
output\verses\genesis\genesis_18_verse_9.wav,"Ni amɛbi lɛ akɛ, “Nɛgbɛ oŋa Sara yɔɔ?” Ni eto he ekɛɛ akɛ, “Eyɛ buu lɛ mli.”",8.43
output\verses\genesis\genesis_18_verse_10.wav,"Amɛteŋ mɔ kome kɛɛ akɛ, “Bɔ fɛɛ bɔ ni fee lɛ maku misɛɛ maba oŋɔɔ wɔsɛɛ afi benɛ mli ni be ni maba lɛ oŋa Sara ena binuu.”",18.86
output\verses\genesis\genesis_18_verse_11.wav,"Abraham kɛ Sara fɛɛ egbɔlɔ ni amɛye afii pii, ni Sara ekpa tsuiasɛɛ yaa.",7.91
output\verses\genesis\genesis_18_verse_12.wav,"No hewɔ lɛ, Sara ŋmɔ yɛ eyitsoŋ ni ekɛɛ, “Belɛ migbɔlɛ nɛɛ mli be ni miwu etsɔ̃ nuumo nɛɛ, mɛɛ miishɛɛ wɔɔna yɛ nuu kɛ yoo bɔlɛ mli.”",12.23
output\verses\genesis\genesis_18_verse_13.wav,"Yehowa bi Abraham akɛ, “Mɛni hewɔ ni Sara ŋmɔ, ni ekɛɛ akɛ, ‘Aso lɛɛlɛŋ akɛ mi ni mitsɔ yoomo nɛɛ mana bi mafɔ lo?’ lɛ.",12.05
output\verses\genesis\genesis_18_verse_14.wav,"Ani nɔ ko wa hã Yehowa lo? Be ni mito lɛ maba oŋɔɔ ekoŋŋ afi naakplɔ benɛ, ni Sara aaana binuu!”",8.81
output\verses\genesis\genesis_18_verse_15.wav,"Shi Sara tso ni ekɛɛ, “Miŋmɔko,” ejaakɛ eeeshe gbeyei. Shi Nuŋtsɔ lɛ kɛɛ, “Dabida, oŋmɔ.”",9.46
output\verses\genesis\genesis_18_verse_16.wav,"Kɛkɛ ni hii etɛ̃ lɛ yi mli kɛjɛ jɛi ni amɛtsɔmɔ amɛhiɛ amɛhã Sodom gbɛ, ni Abraham kɛ amɛ tee eyajie amɛ gbɛ.",10.22
output\verses\genesis\genesis_18_verse_17.wav,"Ni Yehowa kɛɛ akɛ, “Mikɛ nɔ ni mibafee nɛɛ eteŋ Abraham.",5.88
output\verses\genesis\genesis_18_verse_18.wav,"Abraham baatsɔ̃ maŋ kpeteŋkple ni he wa, ni abaajɔɔ shikpɔŋ lɛ nɔ maji fɛɛ kɛtsɔ̃ enɔ,",7.12
output\verses\genesis\genesis_18_verse_19.wav,"ejaakɛ mile lɛ akɛ eeefã ebii kɛ ewebii ni baa yɛ esɛɛ lɛ koni amɛbo mi toi ni amɛfee nɔ ni hi kɛ nɔ ni ja koni nɔ ni mi, Yehowa, miwo shi yɛ ehe lɛ aba mli.”",15.84
output\verses\genesis\genesis_18_verse_20.wav,"Kɛkɛ ni Yehowa kɛɛ akɛ, “Akɛni nibii ni awieɔ ashiɔ Sodom kɛ Gomora lɛ fa, ni amɛhe eshai lɛ efa naakpa hewɔ lɛ,",10.47
output\verses\genesis\genesis_18_verse_21.wav,"makpeleke shi matee mayakwɛ akɛ nibii fɔ̃ji ni awieɔ ashiɔ amɛ ni minuɔ lɛ eyɛ mli nakai lo? Ni kɛji ebɛ mli nakai lɛ, koni male.”",12.11
output\verses\genesis\genesis_18_verse_22.wav,"No hewɔ lɛ, hii enyɔ lɛ tsɔ amɛhe ni amɛtee Sodom gbɛ; shi Abraham damɔ shi yɛ Yehowa hiɛ lolo.",8.53
output\verses\genesis\genesis_18_verse_23.wav,"Kɛkɛ ni Abraham tsi ebɛŋkɛ Yehowa ni ekɛɛ akɛ, “Ani oookpãtã jalɔ kɛ gbɔmɔ fɔŋ fɛɛ hiɛ shi kome lo?",8.51
output\verses\genesis\genesis_18_verse_24.wav,"Ekolɛ benɛ jalɔi nyɔŋmai enumɔ aaahi maŋ lɛ mli. Ani kɛji nakai lɛ, oookpãtã maŋ lɛ hiɛ, ni okɛfaŋ maŋ lɛ yɛ jalɔi nyɔŋmai enumɔ ni yɔɔ mli lɛ ahewɔ?",14.34
output\verses\genesis\genesis_18_verse_25.wav,"Enɛ akagbale bo fɔ̃ŋfɔ̃ akɛ oooye nɛkɛ sane, ni ooogbe jalɔ kɛ gbɔmɔ fɔŋ fɛɛ shi kome, ni jalɔ aaana nɔ tamɔ gbɔmɔ fɔŋ nɔŋŋ lo! Enɛ akagbale bo! Ani shikpɔŋ lɛ fɛɛ nɔ kojolɔ lɛ, ekojoŋ kojomɔ ni ja lo?”",18.04
output\verses\genesis\genesis_18_verse_26.wav,"Kɛkɛ ni Yehowa kɛɛ akɛ, “Kɛji mana jalɔi nyɔŋmai enumɔ yɛ Sodom maŋ lɛ mli lɛ, mikɛbaafa maŋ lɛ fɛɛ yɛ jalɔi lɛ ahewɔ.”",10.0
